{
  "schemaVersion": 1,
  "ledgerId": "v2-proposal-implementation-inventory",
  "status": "descriptive-proposal-status-not-accepted-catalog",
  "sourceRevision": "60b63a79d526c868329ded4134be1f04562f0cf6",
  "catalog": {
    "id": "workload-catalog-v2-proposal",
    "path": "catalog/workloads.v2.proposed.json",
    "proposalCount": 20
  },
  "frozenV1Coverage": {
    "catalogPath": "catalog/workloads.v1.json",
    "catalogSha256": "6665664f984683e5b7d3fdc8c1602198124844704c224a526d48be2f02edf9d4",
    "schemaPath": "schemas/workload-catalog.schema.json",
    "schemaSha256": "7597aad1acd62c1f9a5e9343e8521d1c7906d59fddeec689eec19b50643c4b42",
    "entryCount": 38,
    "implementedCatalogEntries": 0,
    "v2EntriesCounted": false
  },
  "counts": {
    "proposalDefinitions": 20,
    "testedJsAndLinearWasmEngines": 12,
    "definitionOnly": 8,
    "completePublicProposalValidationPackages": 6,
    "completeLocalOnlyProposalValidationPackages": 2,
    "publicValidationRecords": 12,
    "localOnlyValidationRecords": 4,
    "imageEngineOnly": 2,
    "reducedConformanceSlices": 2,
    "interactiveDemos": 3,
    "authoritativePerformanceResultPackages": 0
  },
  "entries": [
    {
      "id": "audio.fft.v1",
      "title": "Radix-2 complex FFT",
      "maturity": "complete-public-proposal-validation-package",
      "definitionSource": {
        "label": "proposal definition",
        "path": "catalog/workloads.v2.proposed.json",
        "url": "https://github.com/PaulKinlan/wasm-vs-js/blob/60b63a79d526c868329ded4134be1f04562f0cf6/catalog/workloads.v2.proposed.json#L30-L177"
      },
      "engine": {
        "status": "tested-js-and-linear-wasm",
        "sourceLinks": [
          {
            "label": "JavaScript source",
            "path": "benchmarks/audio-fft/js.ts",
            "url": "https://github.com/PaulKinlan/wasm-vs-js/blob/60b63a79d526c868329ded4134be1f04562f0cf6/benchmarks/audio-fft/js.ts"
          },
          {
            "label": "linear-Wasm source",
            "path": "benchmarks/audio-fft/audio-fft.wat",
            "url": "https://github.com/PaulKinlan/wasm-vs-js/blob/60b63a79d526c868329ded4134be1f04562f0cf6/benchmarks/audio-fft/audio-fft.wat"
          },
          {
            "label": "workload harness",
            "path": "benchmarks/audio-fft/workload.ts",
            "url": "https://github.com/PaulKinlan/wasm-vs-js/blob/60b63a79d526c868329ded4134be1f04562f0cf6/benchmarks/audio-fft/workload.ts"
          }
        ],
        "unavailableReason": null
      },
      "artifacts": {
        "status": "reproducible-public",
        "repositoryLinks": [
          {
            "label": "build manifest",
            "path": "public/artifacts/audio-fft/build-manifest.json",
            "url": "https://github.com/PaulKinlan/wasm-vs-js/blob/60b63a79d526c868329ded4134be1f04562f0cf6/public/artifacts/audio-fft/build-manifest.json"
          },
          {
            "label": "Wasm artifact",
            "path": "public/artifacts/audio-fft/audio-fft.wasm",
            "url": "https://github.com/PaulKinlan/wasm-vs-js/blob/60b63a79d526c868329ded4134be1f04562f0cf6/public/artifacts/audio-fft/audio-fft.wasm"
          }
        ],
        "publicLinks": [
          {
            "label": "public build manifest",
            "url": "/artifacts/audio-fft/build-manifest.json"
          },
          {
            "label": "public Wasm artifact",
            "url": "/artifacts/audio-fft/audio-fft.wasm"
          }
        ],
        "unavailableReason": null
      },
      "validationResults": {
        "status": "complete-public",
        "recordCount": 2,
        "repositoryLinks": [
          {
            "label": "JavaScript result",
            "path": "public/evidence/v2-proposals/audio-fft/js-controlled.json",
            "url": "https://github.com/PaulKinlan/wasm-vs-js/blob/60b63a79d526c868329ded4134be1f04562f0cf6/public/evidence/v2-proposals/audio-fft/js-controlled.json"
          },
          {
            "label": "linear-Wasm result",
            "path": "public/evidence/v2-proposals/audio-fft/wasm-linear-controlled.json",
            "url": "https://github.com/PaulKinlan/wasm-vs-js/blob/60b63a79d526c868329ded4134be1f04562f0cf6/public/evidence/v2-proposals/audio-fft/wasm-linear-controlled.json"
          }
        ],
        "publicEvidenceLinks": [
          {
            "label": "public JavaScript result",
            "url": "/evidence/v2-proposals/audio-fft/js-controlled.json"
          },
          {
            "label": "public linear-Wasm result",
            "url": "/evidence/v2-proposals/audio-fft/wasm-linear-controlled.json"
          },
          {
            "label": "public evidence page",
            "url": "/evidence/v2-proposals/"
          }
        ],
        "unavailableReason": null,
        "publicEvidenceUnavailableReason": null
      },
      "interactiveDemo": {
        "status": "unavailable",
        "unavailableReason": {
          "code": "no-interactive-demo",
          "detail": "No user-facing interactive demo exists for this proposal ID; tested engines are harness code, not demos."
        },
        "route": null
      },
      "authoritativePerformanceResults": {
        "status": "unavailable",
        "unavailableReason": {
          "code": "no-authoritative-performance-results",
          "detail": "No authoritative performance result package exists for this proposal ID."
        }
      }
    },
    {
      "id": "audio.fir.v1",
      "title": "Finite impulse response convolution",
      "maturity": "complete-public-proposal-validation-package",
      "definitionSource": {
        "label": "proposal definition",
        "path": "catalog/workloads.v2.proposed.json",
        "url": "https://github.com/PaulKinlan/wasm-vs-js/blob/60b63a79d526c868329ded4134be1f04562f0cf6/catalog/workloads.v2.proposed.json#L178-L321"
      },
      "engine": {
        "status": "tested-js-and-linear-wasm",
        "sourceLinks": [
          {
            "label": "JavaScript source",
            "path": "benchmarks/audio-fir/js.ts",
            "url": "https://github.com/PaulKinlan/wasm-vs-js/blob/60b63a79d526c868329ded4134be1f04562f0cf6/benchmarks/audio-fir/js.ts"
          },
          {
            "label": "linear-Wasm source",
            "path": "benchmarks/audio-fir/audio-fir.wat",
            "url": "https://github.com/PaulKinlan/wasm-vs-js/blob/60b63a79d526c868329ded4134be1f04562f0cf6/benchmarks/audio-fir/audio-fir.wat"
          },
          {
            "label": "workload harness",
            "path": "benchmarks/audio-fir/workload.ts",
            "url": "https://github.com/PaulKinlan/wasm-vs-js/blob/60b63a79d526c868329ded4134be1f04562f0cf6/benchmarks/audio-fir/workload.ts"
          }
        ],
        "unavailableReason": null
      },
      "artifacts": {
        "status": "reproducible-public",
        "repositoryLinks": [
          {
            "label": "build manifest",
            "path": "public/artifacts/audio-fir/build-manifest.json",
            "url": "https://github.com/PaulKinlan/wasm-vs-js/blob/60b63a79d526c868329ded4134be1f04562f0cf6/public/artifacts/audio-fir/build-manifest.json"
          },
          {
            "label": "Wasm artifact",
            "path": "public/artifacts/audio-fir/audio-fir.wasm",
            "url": "https://github.com/PaulKinlan/wasm-vs-js/blob/60b63a79d526c868329ded4134be1f04562f0cf6/public/artifacts/audio-fir/audio-fir.wasm"
          }
        ],
        "publicLinks": [
          {
            "label": "public build manifest",
            "url": "/artifacts/audio-fir/build-manifest.json"
          },
          {
            "label": "public Wasm artifact",
            "url": "/artifacts/audio-fir/audio-fir.wasm"
          }
        ],
        "unavailableReason": null
      },
      "validationResults": {
        "status": "complete-public",
        "recordCount": 2,
        "repositoryLinks": [
          {
            "label": "JavaScript result",
            "path": "public/evidence/v2-proposals/audio-fir/js-controlled.json",
            "url": "https://github.com/PaulKinlan/wasm-vs-js/blob/60b63a79d526c868329ded4134be1f04562f0cf6/public/evidence/v2-proposals/audio-fir/js-controlled.json"
          },
          {
            "label": "linear-Wasm result",
            "path": "public/evidence/v2-proposals/audio-fir/wasm-linear-controlled.json",
            "url": "https://github.com/PaulKinlan/wasm-vs-js/blob/60b63a79d526c868329ded4134be1f04562f0cf6/public/evidence/v2-proposals/audio-fir/wasm-linear-controlled.json"
          }
        ],
        "publicEvidenceLinks": [
          {
            "label": "public JavaScript result",
            "url": "/evidence/v2-proposals/audio-fir/js-controlled.json"
          },
          {
            "label": "public linear-Wasm result",
            "url": "/evidence/v2-proposals/audio-fir/wasm-linear-controlled.json"
          },
          {
            "label": "public evidence page",
            "url": "/evidence/v2-proposals/"
          }
        ],
        "unavailableReason": null,
        "publicEvidenceUnavailableReason": null
      },
      "interactiveDemo": {
        "status": "unavailable",
        "unavailableReason": {
          "code": "no-interactive-demo",
          "detail": "No user-facing interactive demo exists for this proposal ID; tested engines are harness code, not demos."
        },
        "route": null
      },
      "authoritativePerformanceResults": {
        "status": "unavailable",
        "unavailableReason": {
          "code": "no-authoritative-performance-results",
          "detail": "No authoritative performance result package exists for this proposal ID."
        }
      }
    },
    {
      "id": "audio.stft.v1",
      "title": "Short-time Fourier transform spectrogram",
      "maturity": "complete-public-proposal-validation-package",
      "definitionSource": {
        "label": "proposal definition",